phrase,target
"Look out for vintage fabric cushion covers , '70s coffee pots , ceramic serving dishes , cocktail glasses , and stainless steel party dishes ",neutral
The combined capital of these funds is expected to be EUR 100mn-150mn ,neutral
Valga Lihatoostus markets its products under the Maks & Moorits trademark ,neutral
"In the Czech Republic , the profiling unit at Ostrava will be closed and the machinery will be relocated to Ruukki 's bigger plants in Hungary , Poland and Romania by the end of the first quarter of 2009 ",neutral
"Elcoteq SE Stock Exchange Announcement February 4 , 2009 at 10.00 am ( EET ) Elcoteq will publish its financial statements bulletin 2008 on Wednesday , February 11 , at 9.00 am ( EET ) ",neutral
"Boomeranger Boats Oy specialises in boat building and designs , manufactures and sells customised Rigid Inflatable Boats RIB primarily for the Baltic Sea market ",neutral
Her last position in Nokia Siemens Networks was head of Business Human Resources NSN global IT ,neutral
"Depending on the market situation , such projects are sold after 1 to 3 years after completion ",neutral
In 2008 Stockmann earned 3.398 million lats in profit on 48.012 million lats in turnover ,neutral
The company reported net sales of 302 mln euro $ 441.6 mln and an operating margin of 16 pct in 2006 ,neutral
The company will be part of Teleste 's Video and Broadband Solutions business area ,neutral
"Country : , Switzerland Sector : Pharmaceuticals Target : Synosia Therapeutics Holding AG Buyer : Biotie Therapies Corp Deal size in USD : 129.4 m Type : Corporate acquisition Financing : All-stock Status : Close",neutral
The following information was released by Comptel : Tomorrow the Chairman of the Federal Communications Commission is scheduled to deliver the National Broadband Plan to Congress ,neutral
The customer is local company Etera Mutual Pension Insurance Co and the principal tenant of the unit will be media company Alma Media Corp HEL : ALN1V ,neutral
Amanda said that it had already made a USD5 .0 m investment commitment in Russia Partners II fund in July 2005 ,neutral
"The Marubeni Group focuses on creating `` value chain '' from upstream to downstream , encompassing a wide variety of business fields , including oil & gas , metals , mineral resources , foods , pulp & paper and chemicals , among others ",neutral
"The Stockmann department store will have a total floor space of over 8,000 square metres and Stockmann 's investment in the project will have a price tag of about EUR 12 million ",neutral
"The objective is that trading in the shares will commence on May 2 , 2007 ",neutral
Why not give your bedroom a cool makeover for summer ,neutral
NWC ANALYSIS ,neutral
Metso 's delivery will include a complete coated board line with related air systems and two winders ,neutral
"Customers wave cards in front of the reader to make payments , similar to `` touch and go '' cards used in transport systems ",neutral
No financial details were disclosed ,neutral
"`` After the transaction , Tikkurila has no powder coatings-related operations , '' the company said ",neutral
Officials did not disclose the contract value ,neutral
"According to HK Ruokatalo , almost all the meat used by the company comes from Finland ",neutral
"The most significant capital expenditure items were in the global enterprise resource planning ERP project , product development and production machines ",neutral
"Simultaneously , his responsibility area is extended from legal affairs to cover also mergers and acquisitions ",neutral
A meeting of Glisten shareholders to vote on the bid will be held on 12 March ,neutral
National sponsors for The Big Read include National Endowment for the Arts in cooperation with the Institute of Museum and Library Services and Arts Midwest ,neutral
"CapMan said the deal 's effect on its cash flow for 2009 totals EUR3 .4 m , but the transaction would not affect its financial results for 2009 as it was executed at fair value ",neutral
"The market making in accordance with the agreement will begin on September 24 , 2009 ",neutral
The products have a low salt and fat content ,neutral
"The 3C Expo is a signature show in Dongguan , which is supported by the Dongguan Municipal Government every year , featuring computer accessories , software , communication and network products ",neutral
"The unit 's clients are mainly in the field of specialist convenience goods , as well as in the textile , shoe and furniture businesses ",neutral
Their offering also covers localisation services related to production transfer to the Finnish company 's customers that already have production in Asian market or have made the decision to transfer production there ,neutral
"In future , the plant will focus on the production of flange profiles for wind farm towers ",neutral
Runway Visual Range is a calculated assessment of the distance that a pilot can see down a runway ,neutral
Less than ten people will face pension agreements ,neutral
"treatment products in Usa , Canada , Mexico , Australia and Brazil Today , Global Research & Data Services is going to publish several market analyses about the markets for water treatment products in some selected countries ",neutral
"At some point , it will spread also to Iran and Iraq ",neutral
The office space will rise above the remodeled Cannon Street underground station ,neutral
Ramirent Finland is the domestic unit of machinery rental company Ramirent Oyj HEL : RMR1V ,neutral
The company did not disclose the price of the acquisition ,neutral
"It is part of the development of the world-class magnetite deposit at Karara , which has the known potential for over 30 million metric tons of annual processing of magnetite over its estimated 30-year life ",neutral
"FL Group 's private equity division manages all operating companies , including Icelandair Group , FL Travel Group , Bluebird and Sterling ",neutral
"More than 50,000 tonnes of asphalt mix will be used in the contract ",neutral
"The guidance has been set at 90 basis points over mid-swaps , the report said ",neutral
"As part of the agreement , Aspocomp will also give Meadville a 10 pct slice of a subsidiary operating in Oulu , Finland ",neutral
"Ethanol would be made from barley , and production could start in 2008 ",neutral
"Panostaja , headquartered in Tampere , Finland , is an investment company focusing on small and medium-sized Finnish companies operating in the traditional industries ",neutral
"ITG 's share in the deal is estimated at some 500,000 euro $ 627,000 ",neutral
The value of the total investment is about EUR 600mn ,neutral
"ENP Newswire - 22 March 2011 Release date - 21032011 - A total of 13,000 Talvivaara Mining Company Plc 's new shares were subscribed for during the period between 1 January 2011 and 28 February 2011 under the company 's stock option rights 2007A ",neutral
"Once your plants are in the ground they will continue to grow , but the success of any garden lies in how well it 's maintained ",neutral
The serial bond is part of the plan to refinance the short-term credit facility ,neutral
"Purchase it for the 12MP snapper , if nothing else ",neutral
"Okhta Center area is expected to have about 700,000 square metres of office premises by 2016 ",neutral
"Supported Nokia phones include : N96 , N95-8GB , N95 , N93-N931 , N92 , N85 , N82 , N81 , N80 , N79 , N78 , N77 , N76 , N75 , N73 , N72 , N71 , E90 , E71 , E70 , E66 , E65 , E62 , E61-E61i , E60 , E51 , E50 , Touch Xpress 5800 , 6220 Classic , 6210 Navigator , 6120 Classic , 6110 Navigator , 5700 , 5500 , 5320XM ",neutral
"rosendal at outotec.com Eila Paatela , Vice President - Corporate Communications tel. +358 20 529 2004 , +358 400 817198 e-mail eila ",neutral
The group reiterated its forecast that handset manufacturers will sell around 915 mln units this year globally ,neutral
The intent of the article was to focus attention on the fact that the development model that China had followed was very different than the model that India had followed ,neutral
IonPhasE 's second major owner is venture capital firm Aura Capital ,neutral
"Sanoma also has an Executive Committee , in accordance with the Company 's Articles of Association , that prepares proposals for matters to be decided or noted by the Board of Directors ",neutral
The full-function PC weighs 1.25 kilograms and measures slightly more than two centimeters thin ,neutral
Analysts surveyed by Thomson Financial expected revenue of $ 69 million for the quarter ,neutral
"China Unicom , NYSE : CHU , HKSE : 0762 , and SHSE : 600050 , the second largest mobile carrier in the country ",neutral
Nordea was the cheapest also for a couple in their 30s with debt ,neutral
It will provide heating in the form of hot water for the sawmill 's needs ,neutral
"Protalix closed at $ 10.71 on Friday on the American Stock Exchange , giving a market cap of $ 827 million ",neutral
Financial terms were not disclosed ,neutral
The value of the order is around EUR 100 million ,neutral
The business development initiatives in North America are headed by Lynn Shanahan ,neutral
The medium-term operative targets of the company remain unchanged ,neutral
"Cramo , headquartered in Vantaa , Finland , rents construction machinery and equipment , as well as rents and sells modular space ",neutral
"The 10,000-odd square metre plot that Stockmann has bought for the Nevsky Center shopping center is located on Nevsky Prospect , St Petersburg 's high street , next to the Vosstaniya Square underground station , in the immediate vicinity of Moscow Station ",neutral
"Unbelievably , the company that makes them - Fiskars Corporation - was formed in 1649 when a Dutch merchant named Peter Thorwoste was given a charter to establish a blast furnace and forging operation in the small Finnish village of Fiskars ",neutral
The final outcome of the rights offering is to be reported around 23 October 2009 ,neutral
"It now owns 80,565 shares in Amer Sports Corporation , equaling 0.11 % of the company 's share capital and voting rights ",neutral
"YIT CORPORATION SEPT. 24 , 2007 at 13:30 CORPORATE RELEASE STOCK EXCHANGE RELEASE YIT 'S CAPITAL MARKETS DAY IN LONDON , SEPT. 26 , 2007 On Wednesday , September 26 , 2007 , YIT will hold a Capital Markets Day for investors and analysts in London ",neutral
"Price talk is in the mid-market swaps plus 105 bps area and the leads are Barclays , BNPP , UBS and CBA ",neutral
"Iso Omena is based in the Matinkyla district of the southern part of the city of Espoo , southern Finland ",neutral
BasWare Order Matching automatically matches purchase invoices with approved purchase orders ,neutral
"Outotec 's scope of delivery includes design , basic engineering and supply of proprietary equipment for a sinter plant with a grate area of 496 square meters ",neutral
Construction is expected to be completed in the summer of 2011 ,neutral
Competition authorities will have to approve the deal before it can be finalized ,neutral
Finnlines will announce in week 17 of 2006 what measures it will take to tackle the situation ,neutral
Okmetic revised its 2010 financial outlook based on its order book ,neutral
"Before FKI , John Jiang has worked in several general manager or senior business consultant positions for international companies in China ",neutral
"Votorantim Celulose e Papel ( VCP ) is part of the Votorantim Group , a major Brazilian conglomerate ",neutral
Mr Skogster currently serves as the manager responsible for ABB Oy 's system modules for low voltage drives ,neutral
"Latin America currently accounts for approximately 40 % of sales at Tecnotree , company president and CEO Eero Mertano recently told BNamericas ",neutral
The value of the contracts is about EUR 3.3 mn ,neutral
The parties have agreed not to disclose the transaction value ,neutral
Sanoma Magazines International will invite other shareholders holding approximately 15 % of the shares to sell their shares ,neutral
`` We know there are some of our own people out there . ',neutral
ASSA ABLOY Kaupthing Bank gave a ` neutral ' recommendation and a share price target of 174 crowns $ 24.7 - 19 euro on Swedish lock maker Assa Abloy AB ,neutral
The firm builds components for mobile phones and other communications products ,neutral
"Elcoteq 's Electronics Manufacturing Services ( EMS ) Business Segment serves customers globally in Engineering , Manufacturing and Fulfillment services ",neutral
"The company is owned by the State of Finland and the European Aeronautic Defense and Space Company EADS N.V. Tekla is an international software company that provides solutions for building and construction , energy distribution and municipalities ",neutral
Kesko has previously published a stock exchange release concerning the deal on 7 February 2007 ,neutral
Another noticeable thing is that the search for Tata and Airtel brands was mostly related to ` broadband connections ' ,neutral
Shuweihat 2 got under way in July 2008 when the project was awarded to desalination and power contractors ,neutral
"However , the brokers ' ratings on the stock differ ",neutral
"The record date for dividend distribution is March 14 , 2008 ",neutral
The value of the deal was not disclosed ,neutral
"The maximum obligated total trades per day is ISK 400,000,000 market value ",neutral
"Erkki Jarvinen , President of Rautakirja and the head of the Sanoma Trade division , will leave his current tasks in spring 2009 for a similar position outside the Sanoma Group ",neutral
Investment management and investment advisory services are the company 's sole line of business ,neutral
"The total restructuring costs are expected to be about EUR 30mn , of which EUR 13.5 mn was booked in December 2008 ",neutral
"In 2009 , Lee & Man had a combined annual production capacity of close to 4.5 million tonnes of paper and 300,000 tonnes of pulp ",neutral
"This action follows personnel negotiations concerning Elcoteq SE , Finnish Branch , Elcoteq Finland Oy and Elcoteq Design Center Oy ",neutral
"As with other stakeholders , COMPTEL has been involved in the workshops , meetings and filed comments on the issues of greatest importance to the competitive sector of our industry ",neutral
"This could be any of us at any time , '' she said ",neutral
Elcoteq SE is listed on the Nasdaq OMX Helsinki Ltd. ,neutral
Technopolis has approximately 130 customer companies in Jyvaskyla ,neutral
Peigs www.peigs.se will become part of Sardus Latta Maltider Light Meals unit ,neutral
"Following the registration , the share capital of Biotie is EUR 52,556,678.10 ",neutral
The company will release its 2010 results on 11 February 2011 ,neutral
"The Filter Tips cover the volume range from 0.1-1200 -ï¿½l including new sizes for 10 , 20 , 100-120 , 200 , 300 , 1000 and 1200 -ï¿½l volume capacities ",neutral
"The total investment in the Vantaa plant extension will amount to around 10 million euro , and Okmetic 's share of the investments will be worth around 2.7 million ",neutral
"- The Group -ï¿½ s profit before taxes was EUR 0,2 7,8 million ",neutral
Vacon controls a further 5 % of the company via investment fund Power Fund I. EUR 1.0 = USD 1.39,neutral
"Previously , the company expected its 2008 financial performance to remain at the same level as in 2008 ",neutral
"In total , more than 3000 surveillance cameras will be handled and managed according to a variety of needs , the company said ",neutral
"CS Cabot exports 55 % of its production mainly to Goodyear , Bridgestone and Michelin plants in Poland , as well as to Germany 's Michelin or Italy 's Pirelli through the company 's logistics center in Paris , Stefan said ",neutral
Mobile communication and wireless broadband provider Nokia Inc NYSE : NOK today set new financial targets and forecasts for Nokia and the mobile device industry and also for Nokia Siemens Networks and the mobile and fixed infrastructure and related services market ,neutral
"CHS Expo Freight is a major Finnish fair , exhibition and culture logistics company that provides logistics services to various events by land , air and sea ",neutral
They will be sunk to a depth of some 360-380 metres and fixed to the bottom mud by vacuum ,neutral
"cents The profile contains business operations , the company history , major products and services , prospects , key competitors , structure and key employees , locations and subsidiaries ",neutral
Okmetic Board of Directors has also decided on a new share ownership program directed to the company 's top management ,neutral
"The works will include the laying of natural stone pavements and the installation of underground heating , and surface water drainage systems ",neutral
"The major part of the deliveries include different AC and CXE amplifier solutions and products by Belgian DINH Telecom , a broadband solutions company acquired by Teleste in the spring of 2007 ",neutral
"The selling consortium includes funds managed by OKO Bank 's venture capital unit , Bio Fund Management and Finnish Industry Investment , a government-owned investment group ",neutral
The fixed acquisition price amounts to NOK 70 ( approximately EUR 8.7 ) million and additional price NOK 15 ( EUR 1.8 ) million at maximum ,neutral
The contract involves refurbishing the bathrooms of 189 units as well as re-plumbing their water and sewer pipes ,neutral
"BAVARIA Industriekapital AG 's 2006 revenues were EUR 333 million , with an EBITDA of EUR 51 million ",neutral
"The copying , republication or redistribution of AFX News Content , inculding by framing or similar means , is expressly prohibited without the prior written consent of AFX News ",neutral
Suomen Paikallissanomat Oy is part of Alma Media Group and it currently publishes 15 local newspapers across Finland ,neutral
"`` We have a license agreement with Nokia Corp. which in part expires on April 9 , 2007 ",neutral
"LONDON AFX - UK and European brokers ' recommendations issued today , as collated by AFX News from a range of market sources ",neutral
Activities range from the development of natural resources to the retailed marketing of finished products ,neutral
"The company , which has EUR2 .8 bn in assets , counts among its five largest shareholders Finnish insurers Ilmarinen 4.34 % and Varma 0.70 % , as well as the Finnish state pension fund VER 0.61 % ",neutral
Why not subscribe to the magazine ,neutral
"Rautalinko was resposnible also for Mobility Services , and his job in this division will be continued by Marek Hintze ",neutral
The proposal by the Board of Directors on the issuance of option rights will otherwise correspond to the proposal by the Board of Directors in the Notice to the General Meeting ,neutral
The EUR17m contract includes both design and construction works ,neutral
We offer our customers solutions based on renewable raw materials ,neutral
"Neste Oil s refineries have a combined crude oil refining capacity of approximately 260,000 barrels a day ",neutral
"The product range includes marinated olives , cold cuts , and pates , for example ",neutral
Net investment incom,neutral
"The second variant offers complete final finishing of any selected apartment with foreign high quality materials ( Finland , Denmark , Germany , France ) ",neutral
"According to Finnair Technical Services , the measure is above all due to the employment situation ",neutral
`` This could be us ,neutral
Its market share is 6 percent according to AC Nielsen 's 2008 data ,neutral
The subscription period of Amer Sports ' 2002 warrant scheme will end on 31 December 2007 ,neutral
"Includes company and brand share data by category , as well as distribution channel data ",neutral
"The contract covers the manufacturing , surface-treatment and installation of the steel structures ",neutral
"Koduextra is operating a retail chain of 11 stores , controlled by Finnish Non-Food Center KY , Rukax OY , and Scan-Tukka OY ",neutral
"Its annual capacity is some 10,000 MW ",neutral
The event can be followed on-line via Orion 's Finnish homepage at www.orion.fi as well as via the Kauppalehti Live web service at www.kauppalehti.fi/live ,neutral
Image data produced by the browser at the phone server is converted into a bitmapped image that is sent to the handset for display . ',neutral
Raute is listed on the Nordic exchange in Helsinki ,neutral
"BasWare Invoice Processing , BasWare Contract Matching , BasWare Order Matching and BasWare KPI Reporting Tool are part of the BasWare 's Enterprise Purchase to Pay product suite ",neutral
"With the U.S. Federal Government putting a stake in the ground , vendors - and their customers - are focused on meeting the deadline ",neutral
"Estonia 's Agriculture Minister Helir-Valdor Seeder is in Finland on a two-day visit , in the course of which he will meet with his Finnish counterpart Sirkka-Liisa Anttila ",neutral
"Featuring the S60 user interface , this 135-gram model also comes with a 2.4-inch quarter VGA display and 100 megabytes of internal memory , expandable through the Micro Secure Digital slot ",neutral
"The order includes a log handling line , peeling line and drying line for the production of parquet base layer veneer for Plyfa 's Hassela mill , central Sweden ",neutral
"Participants at any of the book discussions or other special events , or visitors to the car dealership were eligible to enter the drawing for the 2005 silver , four-door Altima ",neutral
"The business area has operations in Finland , Sweden , Denmark , Estonia , Latvia and Lithuania ",neutral
Catalysts segment includes refinery catalysts and polyolefin catalysts product categories ,neutral
"The cost of the deal could range from 70 million to 90 million euros depending on the financial results of the two companies in 2008 , the statement says ",neutral
"The facility will have a lettable area of some 19,000 sq m. The plot for the plant , located in the Ratasmaki business park , will be purchased from the City of Forssa ",neutral
Mr. Koistinen joins from Nokia Siemens Networks where he has held various senior sales management and business development positions since 1997 ,neutral
"An  of the invention , released by the Patent Office , said : `` The chambers are pressurized ",neutral
"The address location is provided to a local controller , preferably by wireless transmission , which then uses the address location to access the appliance control module ",neutral
They both will report to Oriola-KD 's chief executive officer Eero Hautaniemi ,neutral
"The port facilities ' throughput is 250,000 TEUs and 7.5 mln tons of general cargo ",neutral
Increase in the number of shares is based on the option rights which were granted to the management of the company under the stock option plan 2006 ,neutral
"Country : , Finland Sector : Construction-Real Estate Target : Pohjolan Design-Talo Oy Buyer : CapMan Oyj Vendor : Ruukki Group Oyj Deal size in USD : 102.6 m Type : Divestment Status : Agree",neutral
"Aug. 17 , 2010 ( Curbed delivered by Newstex ) -- And now , the latest from Racked , covering shopping and retail from the sidewalks up ",neutral
`` We could be there ,neutral
"In addition to verification of an identity and digital signatures , new state-approved Mobile ID enables to cast votes in elections as well ",neutral
The new organization consists of two business units : Charging & Messaging and Finance & Administration ,neutral
"Our key geographical markets are Europe , Russian Federation , Middle-East , South-Africa and Japan ",neutral
Teleste has some 30 offices worldwide and is listed on the Nordic Exchange in Helsinki ,neutral
"Taking a cue from the playbook of the East Dillon Lions , we 've created a special team of heavy-hitting style players , such as boot-cut jeans , tummy tops and , of course , cowboy boots ",neutral
"The business had gross written premiums of EUR152 .4 m (  91.5 m ) in 2000 , a net combined ratio of 133 % and 175 staff in total with offices in the UK , Germany and Benelux ",neutral
"Jon Risfelt has previously held operational executive positions in Europolitan , Ericsson , SAS , American Express card and travel divisions , as well as Nyman & Schultz ( CEO ) , Vodafone Sweden ( CEO ) , and Gambro Renal Products ( CEO ) ",neutral
The divested activities had net sales of EUR 145.1 million in 2009 and an operating profit of EUR 8.9 million ,neutral
The maximum number of new shares to be offered is 22 million ,neutral
"The casing comprises a first side casing member provided with the first side vat segment and a second side casing member provided with the second side vat segment , at least the first side casing member being pivotable about a rotation axis ",neutral
"About 72 % of Evraz Group shares are owned by Lanebrook , whose beneficiaries , on the one hand , are Millhouse , the holding company for the assets of billionaire Roman Abramovich and his business partners 50 % ; and Evraz executives Alexander Abramov and Alexander Frolov 50 % , on the other ",neutral
"EQ Bank forecasts Olvi 's net sales at EUR 67mn in the second quarter of 2009 , and operating profit at EUR 6.4 mn ",neutral
The identity of the buyer is not yet known ,neutral
Her present position is the director of Stockmann 's international department stores ,neutral
"Companies evaluated in the report include Aladdin , CA , F-Secure , Kaspersky , Marshal , McAfee , Microsoft , Panda , Proofpoint , Sophos , Symantec , Trend Micro , Tumbleweed , and Websense ",neutral
The company website is www.ahlstrom.com ,neutral
The sellers were the founders of the company ,neutral
`` The issues identified by Stonesoft affect a range of content inspection technology ,neutral
Exel wants to serve its industrial customers with individual products ,neutral
Stora is due to release its fourth-quarter and 2009 full-year earnings on Feb. 4 ,neutral
"The Polish business employs about 1,000 people , and it had net sales of about EUR 70mn in 2007 ",neutral
