phrase,target
"Global sports equipment maker Amer Sports Corp. , whose brands include Atomic , Salomon and Wilson , saw a 64 percent increase in third-quarter net profit to EURO 47.4 million $ 65 million on strong sales and cost cuts ",positive
It estimates the operating profit to further improve from the third quarter ,positive
"Previously , EB delivered a custom solution for LG Electronics and now is making it commercially available for other mobile terminal vendors as well as to wireless operators ",positive
Finnish department store chain Stockmann Oyj Abp net profit rose to 39.8 mln euro ( $ 56.8 mln ) for the first nine months of 2007 from 37.4 mln euro ( $ 53.4 mln ) for the same period of 2006 ,positive
"Finnish high technology provider Vaahto Group reports net sales of EUR 41.8 mn in the accounting period September 2007 - February 2008 , an increase of 11.2 % from a year earlier ",positive
"Cash flow from operations totalled EUR 7.4 mn , compared to a negative EUR 68.6 mn in the second quarter of 2008 ",positive
Major Order in India Comptel Corporation has received a significant long-term order for mediation and provisioning solutions being used by a leading operator in India ,positive
Operating profit excluding non-recurring items increased by 27 % to EUR 81.9 mn from EUR 64.4 mn in the corresponding period in 2008 ,positive
Our standardised services have met with a positive reception among our customers as well as at Itella ,positive
"Finnish investment group Panostaja Oyj said its net profit went up to 8.6 mln euro $ 11.4 mln in fiscal 2005-06 , ended October 31 , 2006 , from 2.8 mln euro $ 3.7 mln in the same period of fiscal 2004-05 ",positive
It also turned to earnings per share ( EPS ) of EUR 0.08 versus loss per share of EUR 0.04 ,positive
"Revenue from July to September grew 21 percent to EURO 2.3 billion , the Finnish company said Thursday ",positive
"Net income from life insurance rose to EUR 16.5 mn from EUR 14.0 mn , and net income from non-life insurance to EUR 22.6 mn from EUR 15.2 mn in 2009 ",positive
"Arvo Vuorenmaa , the Loviisa plant 's general manager said the application for the new licence was a `` standard '' procedure and that he was `` quite confident '' about approval being granted ",positive
"In January-September 2009 , the Group 's net interest income increased to EUR 112.4 mn from EUR 74.3 mn in January-September 2008 ",positive
"However , the proportion of the paid standing orders grew in 2009 ",positive
The company 's market share is continued to increase further ,positive
"Raute posted a net profit of 1.8 mln euro $ 2.6 mln for the third quarter of 2007 , compared to a net loss of 299,000 euro $ 430,000 for the corresponding period of 2006 ",positive
Finlan 's listed food industry company HKScan Group controlled companies in the Baltics improved revenues by EUR 3.5 mn to EUR 160.4 mn in 2010 from EUR 156.9 mn in the year before ,positive
"In Lithuania , operating profit rose to EUR 190,000 from EUR 70,000 in the corresponding period in 2005 ",positive
"MegaFon 's subscriber base increased 16.1 % in 2009 to 50.5 million users as of December 31 , while its market share by the number of customers amounted to 24 % as of late 2009 , up from 23 % as of late 2008 , according to TeliaSonera estimates ",positive
"After the reporting period , BioTie North American licensing partner Somaxon Pharmaceuticals announced positive results with nalmefene in a pilot Phase 2 clinical trial for smoking cessation ",positive
"Operating profit of Kauppalehti group rose to EUR 1.5 mn from EUR 1.3 mn , and that of Marketplaces to EUR 1.3 mn from EUR 1.0 mn in the third quarter of 2006 ",positive
"Sales improved to SEK 1,553 mn , compared with SEK 1,408 mn ",positive
"The company 's net profit rose 11.4 % on the year to 82.2 million euros in 2005 on sales of 686.5 million euros , 13.8 % up on the year , the company said earlier ",positive
Last year 's net sales rose to EUR 68.3 million from EUR 62.2 million ,positive
"The fair value of the investment properties totaled EUR 2,534.9 mn , up from EUR 2,455.1 mn in 2006 ",positive
"Finnish financial group Aktia reports operating profit of EUR 44.4 mn in January-September 2009 , up from EUR 37.3 mn in the corresponding period in 2008 ",positive
"Svyturys-Utenos Alus , which is controlled by the Nordic group Baltic Beverages Holding ( BBH ) , posted a 6.1 percent growth in beer sales for January-September to 101.99 million liters ",positive
"Order intake grew by 40 % year-on-year and 30 % year-on-year , respectively , to EUR 576 million and EUR 1.7 billion for the respective January-September and July-September 2010 periods ",positive
"Operating profit for the three-month period increased from EUR1 .2 m , while revenue increased from EUR20 .2 m , as compared to the corresponding period in 2005 ",positive
"( ADP News ) - Feb 11 , 2009 - Finnish management software solutions provider Ixonos Oyj ( HEL : XNS1V ) said today its net profit rose to EUR 3.5 million ( USD 4.5 m ) for 2008 from EUR 3.1 million for 2007 ",positive
The pretax profit of the group 's life insurance business increased to EUR36m from EUR27m ,positive
The agreement strengthens our long-term partnership with Nokia Siemens Networks ,positive
`` We are pleased with the efforts of both negotiating teams and look forward to a productive four years ahead . ',positive
Operating result including non-recurring items rose to EUR 146mn from a loss of EUR 267mn in 2009 ,positive
"Pretax profit totalled EUR 2.0 mn , compared to a loss of EUR 159.2 mn in the fourth quarter of 2008 ",positive
"( ADP News ) - Oct 29 , 2008 - Finnish lifting equipment maker Konecranes Oyj ( OMX : KCR1V ) said today that its net profit rose to EUR 116.6 million ( USD 149.1 m ) in the first nine months of 2008 from EUR 73.6 million for the ",positive
"Clothing retail chain Sepp+ï¿½l+ï¿½ 's sales increased by 8 % to EUR 155.2 mn , and operating profit rose to EUR 31.1 mn from EUR 17.1 mn in 2004 ",positive
"Earnings per share for the quarter were also higher year-on-year at 0.33 eur versus 0.27 , and above market expectations of 0.28 eur ",positive
"The world 's second largest stainless steel maker said net profit in the three-month period until Dec. 31 surged to euro603 million US$ 781 million , or euro3 .33 US$ 4.31 per share , from euro172 million , or euro0 .94 per share , the previous year ",positive
"Operating profit totalled EUR 0.4 mn , up from an operating loss of EUR 0.8 mn year-on-year ",positive
Operating profit rose to EUR 103.4 mn from EUR 23.2 in the corresponding period in 2006 ,positive
Sales of security and system packaging increased slightly ,positive
Sports equipment sales also progressed well owing to the prolonged winter season ,positive
"Metsaliitto , however , narrowed its net loss for the second quarter of 2007 to 5.0 mln euro $ 6.9 mln from 61 mln euro $ 83.7 mln a year ago ",positive
"In the end of 2006 , the number of outlets will rise to 60-70 ",positive
"A Helsinki : ELIiV today reported EPS of EUR1 .13 for 2009 , an increase over EPS of EUR1 .12 in 2008 ",positive
Earnings per share EPS rose to EUR 0.11 from EUR 0.03 ,positive
"Excluding non-recurring items , pre-tax profit surged 45 % to EUR80m ",positive
Finnish Bank of +ï¿½land reports its operating profit rose to EUR 21.3 mn in the second quarter of 2009 from EUR 6.1 mn in the corresponding period in 2008 ,positive
"Cost savings will then rise to some 20 mln eur a year from 2007 , OKO said ",positive
"Nevertheless , its market share rose to 49.14 percent from 48.51 percent a year earlier ",positive
"The sale , which will result in a gain of some EUR 60 million in the second quarter of 2010 for Oriola-KD , supports the Finnish company 's strategy to focus on pharmaceutical wholesale and retail operations ",positive
"Finnish pulp and paper machinery maker Vaahto Group Oyj swung to a 1.1 mln euro $ 1.4 mln net profit in the fiscal 2005-06 , ended August 31 , 2006 , from a 249,000 euro $ 319,000 net loss in the fiscal 2004-05 ",positive
"Operating profit was EUR 0.6 mn , up from a loss of EUR 19mn a year earlier ",positive
"The earnings per share for the quarter came in at 0.25 eur , up from the 0.20 eur of the same quarter a year earlier ",positive
"In 2008 , the deal is likely to bring savings of EUR 20mn-25mn ",positive
The growth of net sales has continued favourably in the Middle East and Africaand in Asia Pacific ,positive
The acquisition will considerably increase Kemira 's sales and market position in the Russian metal industry coatings market ,positive
Net sales surged by 30 % to EUR 36 million ,positive
"The disposal of Autotank will also strengthen Aspo 's capital structure , '' commented Gustav Nyberg , CEO of Aspo ",positive
Finnish KCI Konecranes has been awarded an order for four hot metal ladle cranes by Indian steel producer Bhushan Steel & Strips to be delivered in 2007 ,positive
"The six breweries recorded a 5.2 percent growth in domestic beer sales last year to 270.21 million liters , from 256.88 million liters sold in 2005 ",positive
`` Demand for sports equipment was good in 2005 ,positive
"The company 's order book stood at 1.5 bln euro $ 2.2 bln on September 30 , 2007 , up by 24.2 pct on the year , with international orders amounting to 365 mln euro $ 534.3 mln ",positive
8 May 2009 - Finnish liquid handling products and diagnostic test systems maker Biohit Oyj ( HEL : BIOBV ) said today ( 8 May 2009 ) its net loss narrowed to EUR0 .1 m ( USD0 .14 m ) for the first quarter of 2009 from EUR0 .4 m for the same period of 2008 ,positive
Sales rose 10 pct to 566 mln eur on the back of strong volume and favourable currency effects ,positive
"We succeeded in increasing our market share of sold apartment '' , comments Mr Kari Kauniskangas , Head of YIT International Construction Services ",positive
"The financial impact is estimated to be an annual improvement of EUR2 .0 m in the division 's results , as of fiscal year 2008 ",positive
"EBIT totalled EUR 14.4 mn , compared to a loss of EUR 0.3 mn in the corresponding period in 2009 ",positive
Its market share widened to 48.51 percent from 48.31 percent a year earlier ,positive
"EBITDA for the year 2009 improved to EUR484m , as compared with EUR472m in 2008 ",positive
"HELSINKI ( AFX ) - Shares closed higher , led by Nokia after it announced plans to team up with Sanyo to manufacture 3G handsets , and by Nokian Tyres after its fourth-quarter earnings report beat analysts ' expectations , dealers said ",positive
"Progress Group , QPR 's representative in Saudi Arabia and North Africa , has signed a framework agreement for a long term strategic relationship with ISE ",positive
- Operating profit rose by 26.9 % to EUR 105.8 ( 83.4 ) million ,positive
"9 September 2010 - Finnish stationery and gift retailer Tiimari HEL : TII1V said today its net sales rose by 2 % year-on-year to EUR5 .7 m in August 2010 , driven by growth in Finland , while demand in the Baltics remained weak ",positive
Turnover rose to EUR21m from EUR17m ,positive
"Operating profit totalled EUR 83.0 mn , up from EUR 23.5 mn year-on-year ",positive
The company will make its marketing and sales investments initiated in 2009 even more efficient in 2010 ,positive
"In the second quarter of 2010 , the company 's net profit was EUR1 .7 m compared to a net loss of EUR1 .3 m in April-June 2009 ",positive
Pretax profit jumped to EUR 21.9 million from EUR 3.1 million ,positive
"Basware Corporation stock exchange release August 31 , 2010 at 16:25 Basware signed a large deal with an international industrial group Basware will deliver Invoice Automation solution and Connectivity Services to an international industrial group ",positive
"Advertising and circulation revenues grew by 3.4 % and by 0.4 % , respectively ",positive
"The Helsinki-based company , which also owns the Salomon , Atomic and Suunto brands , said net profit rose 15 percent in the three months through Dec. 31 to (  x20ac ) 47 million ( $ 61US million ) , from (  x20ac ) 40.8 million a year earlier ",positive
Nordea Group 's operating profit increased in 2010 by 18 percent year-on-year to 3.64 billion euros and total revenue by 3 percent to 9.33 billion euros ,positive
The EPS improved to EUR0 .38 from EUR0 .27 ,positive
"Finnish lifting equipment maker Konecranes Oyj said on July 30 , 2008 that its net profit rose to 71.2 mln euro ( $ 111.1 mln ) for the first half of 2008 from 57.1 mln euro ( $ 89.1 mln ) for the same period of 2007 ",positive
"With CapMan as a partner , we will be able to further develop our business and continue to focus on providing quality restaurant services for our customers , '' says Christopher Wynne , CEO of Papa John 's Russia ",positive
Revenue grew 12 percent to (  x20ac ) 3.6 billion ( US$ 4.5 billion ) ,positive
Rapala said it estimates it will make savings of 1-2 mln eur a year by centralising its French operations at one site ,positive
Kone 's net sales rose by some 14 % year-on-year in the first nine months of 2008 ,positive
"The total delivery volume of paper businesses in 2010 was 1,155,000 tonnes , up from 1,132,000 tonnes in 2009 ",positive
"These financing arrangements will enable the company to ensure , in line with its treasury policy , that it has sufficient financial instruments at its disposal for its potential capital requirements ",positive
"HELSINKI ( AFX ) - Nokian Tyres reported a fourth quarter pretax profit of 61.5 mln eur , up from 48.6 mln on the back of strong sales ",positive
"The refining margin for the year was $ 13.39 - bbl , compared to $ 10.46 - bbl in the prior year ",positive
"In the third quarter , net sales increased by 12 % year-on-year to EUR 159.5 million , or by 6 % at comparable currency rates growth ",positive
"Shares of Standard Chartered ( STAN ) rose 1.2 % in the FTSE 100 , while Royal Bank of Scotland ( RBS ) shares rose 2 % and Barclays shares ( BARC ) ( BCS ) were up 1.7 % ",positive
"Turnover surged to EUR61 .8 m from EUR47 .6 m due to increasing service demand , especially in the third quarter , and the overall growth of its business ",positive
Net sales increased to EUR655m in April to June 2010 from EUR438m a year earlier ,positive
"In the reporting period , net sales rose by 8 % year-on-year to EUR64 .3 m , due to the business acquisitions realized during the first half of 2008-09 , the effect of which was EUR10 .9 m in the review period ",positive
"Both operating profit and net sales for the nine-month period increased , respectively by 26.6 % and 3.4 % , as compared to the corresponding period in 2006 ",positive
Viking Line manages well with its current ferries ,positive
"In its financial report , published on Friday , SEB said its net profit soared to SEK6 .745 bn in 2010 from a year-earlier SEK1 .114 bn and proposed a 50 % dividend increase to SEK1 .50 per share ",positive
"MANAVIGATOR-September 7 , 2010-Kemira unveils Indian JV with IVRCL Finnish chemicals group Kemira ( HEL : KRA1V ) on Tuesday announced it has inked a deal to form a joint venture in India with local construction firm IVRCL Infrastructure and Projects Ltd ( BOM :530773 ) ",positive
"Fiskars Brands report net sales of EUR 145.8 mn , up from EUR 138.4 mn ",positive
"Net interest income was EUR 152.2 mn , up from EUR 101.0 mn in 2008 ",positive
"Finland 's national carrier Finnair PLC carried a record 8.5 million passengers in 2005 , an increase of 4.5 percent on the previous year , the airline reported Tuesday ",positive
"In January-September 2007 , Finnlines ' net sales rose to EUR 505.4 mn from EUR 473.5 mn in the corresponding period in 2006 ",positive
"However , Biohit estimates its total net sales will continue to grow in 2009 , and that favourable trends in net sales will lead to a profit in 2009 ",positive
"Finnish Suominen Corporation that specialises in wet wipes , nonwovens , and flexible packaging reports net sales of EUR 44.1 mn in the second quarter of 2010 , up from EUR 43.3 mn in the second quarter of 2009 ",positive
"EPS for the quarter came in at 0.36 eur , up from 0.33 eur a year ago and ahead of forecast of 0.33 eur ",positive
"In the first nine months of 2010 , the company 's net loss narrowed to EUR415 ,000 from EUR7 .4 m for the corresponding period of 2009 ",positive
Operating profit rose to EUR 3.11 mn from EUR 1.22 mn in the corresponding period in 2009 ,positive
"In the third quarter , net sales increased by 12 % year-on-year to EUR159 .5 m , or by 6 % at comparable currency rates growth ",positive
"Finnish Talentum reports its operating profit increased to EUR 20.5 mn in 2005 from EUR 9.3 mn in 2004 , and net sales totaled EUR 103.3 mn , up from EUR 96.4 mn ",positive
"In the fourth quarter of 2008 , net sales increased by 2 % to EUR 1,050.7 mn from EUR 1,027.0 mn in the fourth quarter of 2007 ",positive
Incap Contract Manufacturing Services Private Limited has inked agreements with six new customers in India ,positive
The company expects net sales to significantly increase from 2009 ,positive
"Profit for the period was EUR 5.9 mn , up from EUR 1.3 mn ",positive
"The Lithuanian beer market made up 14.41 million liters in January , a rise of 0.8 percent from the year-earlier figure , the Lithuanian Brewers ' Association reporting citing the results from its members ",positive
HELSINKI AFX - KCI Konecranes said it has won an order for four hot metal ladle cranes from Indian steel producer Bhushan Steel and Strips Ltd. ,positive
Construction volumes meanwhile grow at a rate of 10-15 percent annually ,positive
Revenues at the same time grew 14 percent to 43 million euros ,positive
Operating profit increased by 145.1 % to EUR 8.3 mn from EUR 3.4 mn ,positive
"Equity ratio was 60.9 % compared to 54.2 % In the third quarter of 2007 , net sales of the Frozen Foods Business totaled EUR 11.0 , up by about 5 % from the third quarter of 2006 ",positive
Finnish forest machinery manufacturer Ponsse 's net sales grew to EUR 51.3 mn in the first quarter of 2010 from EUR 37.5 mn in the corresponding period in 2009 ,positive
Finnish elevators and escalators maker KONE Corporation said on Tuesday ( 18 March ) that it has received a major order from Sir Robert McAlpine to supply all elevators and escalators for the Watermark Place project in the City of London ,positive
"Finnish security and privacy software solutions developer Stonesoft Oyj said on January 7 , 2008 that the preliminary sales of its StoneGate products grew by 59 pct year-on-year to 3.6 mln euro ( $ 5.3 mln ) for the fourth quarter of 2007 ",positive
"Earnings per share for January-June 2010 were EUR0 .30 , an increase of 20 % year-on-year EUR0 .25 ",positive
The company turned to earnings per share ( EPS ) of EUR 0.03 versus loss per share of EUR 0.01 ,positive
"Uponor made an operating profit of EUR 151.0 mn , up from EUR 143.7 mn , which made 2007 a record year ",positive
Circulation revenue has increased by 5 % in Finland and 4 % in Sweden in 2008 ,positive
Operating profit rose to 22.1 mln eur from 19.9 mln ,positive
"a January 11 , 2010 EPHC board of directors has approved an increase in the quarterly dividend from $ 0.03 to $ 0.05 per share ",positive
"Lithuanian beer makers sold 256.88 million liters of beer in 2005 , a rise of 4.5 per cent from the year-earlier figure of 245.92 million liters ",positive
"Sales in Latin America increased by 42 % to EUR 432mn , and a total of 8.7 mn mobile devices were sold in the area , representing an increase of 32 % from the corresponding period in 2009 ",positive
"Finnish energy company Fortum Oyj said on November 13 , 2007 it was granted an environmental permit to build a biofuel-fired combined heat and power CHP plant in Vartan harbor in eastern Stockholm ",positive
"Turun kaupunkin , Finland based company has awarded contract to Lemminkainen Talotekniikka Oy for electrical installation work ",positive
The actions are expected to deliver annual cost savings of some EUR15-20m ,positive
"Operating profit totalled EUR 21.1 mn , up from EUR 18.6 mn in 2007 , representing 9.7 % of net sales ",positive
The stock rose for a second day on Wednesday bringing its two-day rise to GBX12 .0 or 2.0 % ,positive
"Ragutis , which is based in Lithuania 's second-largest city Kaunas , boosted its sales last year 22.3 per cent to 36.4 million liters ",positive
"( ADP News ) - Oct 1 , 2008 - Finnish consulting and engineering company Poyry Oyj ( OMX : POY1V ) said today it was awarded a EUR 5.2 million ( USD 7.4 m ) extension to their existing consultancy engineering contract with Venezue",positive
Exports grew 16.5 percent to 19.1 million liters ,positive
Uponor improved its performance in spite of the decrease in residential construction in the US ,positive
"Earnings per share ( EPS ) were EUR0 .03 , up from the loss of EUR0 .083 ",positive
Finnish office supplies and computer accessories dealer Beltton-Group Plc said its net profit rose to 1.3 mln euro ( $ 1.7 mln ) in 2006 from 1.13 mln euro ( $ 1.5 mln ) in 2005 ,positive
"Both operating profit and net sales for the 12-month period increased , respectively from EUR20 .8 m and EUR177 .7 m , as compared to the financial year 2004 ",positive
Orion Pharma 's operating profit increased by 42.5 % from 2004 ,positive
"Cash flow from operations totalled EUR 2.71 mn , compared to a negative EUR 0.83 mn in the corresponding period in 2008 ",positive
Profit for the period was EUR 15.6 mn compared to EUR 14.1 mn in 2007 ,positive
"Operating profit totaled EUR 37,7 mn , up slightly from EUR 37.2 mn in the corresponding period in 2006 ",positive
`` The combined activities will create value for shareholders and be good for our employees and customers ,positive
"Finnish flexible packaging manufacturer Suominen Corporation reports net sales of EUR 54.5 mn in the first quarter of 2008 , compared with EUR 54.3 mn a year earlier ",positive
Finnish Bore that is owned by the Rettig family has grown recently through the acquisition of smaller shipping companies ,positive
"The brokerage said 2006 has seen a ` true turning point ' in European steel base prices , with better pricing seen carrying through the second quarter of 2006 ",positive
The Department Store Division reported an increase in sales of 4 per cent ,positive
"Finnish telecoms software developer Tecnomen Oyj said on December 5 , 2006 it won a $ 3.3 mln ( 2.5 mln euro ) order to supply an expansion of the charging and messaging systems for the mobile and fixed networks of Brasil Telecom ",positive
"`` UPM 's deliveries increased during the third quarter by 4 percent , and the efficiency of operations improved , '' Chief Executive Jussi Pesonen said ",positive
Net sales of the Vegetable Oil Business rose to EUR 10.6 mn from EUR 10.1 mn ,positive
"Satama 's net profit for the third quarter of 2007 rose to 275,000 euro ( $ 395,000 ) from 270,000 euro ( $ 388,000 ) for the same period of 2006 ",positive
The company anticipates its turnover for the whole 2010 to surpass that of the previous year when it was EUR 67.1 million ,positive
"At the same time profit of the company increased by 10 % in H1 and reached Ls 79,000 ",positive
"Theodosopoulos said Tellabs could be of value to Nokia Siemens or Nortel given its `` leading supply status '' with Verizon , along with high-growth products ",positive
27 January 2011 - Finnish IT solutions provider Affecto Oyj ( HEL : AFE1V ) said today it has won a EUR1 .2 m ( USD1 .6 m ) contract from state-owned Lithuanian Social Insurance Institution ( SODRA ) ,positive
"Suominen Corporation estimates that the cost-cutting program that started in autumn 2005 , higher sales prices , and expected growth in volume of Wet Wipes , will make the company 's operations more profitable ",positive
"In the second quarter of 2010 , Raute 's net loss narrowed to EUR 123,000 from EUR 1.5 million in the same period of 2009 ",positive
"Return on investment was 5.0 % , compared to a negative 4.1 % in 2009 ",positive
"The company 's operating income ( EBIT ) totalled EUR 0.0 mn , up from EUR -0.3 mn year-on-year ",positive
It will also strengthen Ruukki 's offshore business ,positive
"Kesko Agro Eesti , the retailer and wholesaler of grain , agricultural and warehousing machinery and accessories , had net sales of 81 million euros in 2007 , an increase by one-tenth over the preceding year ",positive
"The chain posted sales of 298 million euros for full 2005 , a rise of 19.5 percent , year-on-year ",positive
"The company recorded revenues of E658 .1 million during the fiscal year ended December 2007 , an increase of 23 % over 2006 ",positive
"Operating profit surged to EUR21m from EUR106 ,000 ",positive
10 February 2011 - Finnish media company Sanoma Oyj HEL : SAA1V said yesterday its 2010 net profit almost tripled to EUR297 .3 m from EUR107 .1 m for 2009 and announced a proposal for a raised payout ,positive
Finnish Aktia Group 's operating profit rose to EUR 17.5 mn in the first quarter of 2010 from EUR 8.2 mn in the first quarter of 2009 ,positive
"Previously , the company anticipated its operating profit to improve over the same period ",positive
SKF 6 April 2010 - Alandsbanken has given a `` buy '' recommendation on Swedish industrial company SKF AB ( STO : SKF B ) with a share price target of SEK150 ,positive
"Bilfinger investors cheered the agreement , pushing shares up 7 % , or & euro ; 3.30 , to & euro ; 50.29 , in afternoon trade ",positive
"Profit for the period totaled EUR 39.4 mn , up from EUR 33.9 mn in the corresponding period in 2006 ",positive
"Pre-tax loss totaled EUR 0.3 mn , compared to a loss of EUR 2.2 mn in the first quarter of 2005 ",positive
15 December 2010 - Finnish-German telecoms equipment maker Nokia Siemens Networks said today it won a contract to upgrade the radio network of home-based telecommunications company Elisa Oyj HEL : ELI1V ,positive
