phrase,target
"In the method the smelt spouts 2 are separated from the working area 6 by a shielding wall 8 , 10 arranged movable in relation to the smelt spouts ",neutral
"ALEXANDRIA , Va. , May 16 -- Kenneth Bower of Vista , Calif. , has developed an ornamental design for a handset , the U.S. Patent & Trademark Office announced ",neutral
"says Brian Burton , Head of IT Security , Vodafone UK ",neutral
"The bond , with a maturity of five years , is part of the bank 's domestic bond program ",neutral
"Following the issue , the new shares will constitute 10 percent of the firm 's capital ",neutral
"The mall is part of the Baltic Pearl development project in the city of St Petersburg , where Baltic Pearl CJSC , a subsidiary of Shanghai Foreign Joint Investment Company , is developing homes for 35,000 people ",neutral
M. and a Master of Business Administration MBA ,neutral
"About 36 % of this came from Aspo Chemicals , 39 % from Aspo Shipping and 25 % from Aspo Systems ",neutral
The deal is subject to approval by the Norwegian competition authorities ,neutral
A paper mill in the central Maine town of Madison soon will have a new owner ,neutral
The order also includes start-up and commissioning services ,neutral
Closing of such transaction took place today ,neutral
"The devices would be launched in the Chinese market in late 2006 , the company said ",neutral
"May 29 , 2010 ( CompaniesandMarkets.com delivered by Newstex ) -- This report provides key data and information on the meat , fish and poultry market in Finland ",neutral
The total project duration is three years and it is valued at some EUR11 .5 m,neutral
Name of Company in which holdings have been acquired : Citycon Oyj 2 ,neutral
This organization will assume the responsibility for operations in Russia ,neutral
"One price category is for calls on the preferred operator 's network , and another for calls on other operators ' networks ",neutral
The plant is expected to enter commercial operation by mid-2009 ,neutral
The contract is worth some EUR 1 million ,neutral
Insurance policies should be simple ,neutral
The order is related to renewing the network of the telecommunications operator ,neutral
The contract will take effect in 2009 for a five or ten year period ,neutral
18:30 Dinner The conference program can also be viewed as a live audio webcast through the internet pages at www.citycon.com ,neutral
The duration of the contract is 37 months ,neutral
"In the third quarter of 2007 , net sales totaled EUR 25.95 mn , and operating profit EUR 3.88 mn ",neutral
"The market share of Volkswagen passenger cars in Finland was 10.1 percent , Audi had a market share of 3.1 percent and Seat 's share was 0.9 percent ",neutral
"Tekla will organize an information meeting for analysts and media at WTC Helsinki Marski meeting room , Aleksanterinkatu 17 , the same day at 12:30 - 1:30 p.m. Light lunch will be served ",neutral
The new location is n't the only change Wellmont has in store for its air transport service ,neutral
"Marathon now has a 4.6 percent stake in PLX , it said , according to Bloomberg ",neutral
The shares shall be acquired according to the Rules of NASDAQ OMX Helsinki and otherwise according to the rules related to acquisition of the company 's own shares ,neutral
"In accordance with the terms and conditions of Alma Media 's 2006 option program , the share subscription price for the 2006A option rights was EUR 4.88 per share and the book countervalue EUR 0.60 per share ",neutral
"Of these shares 14,747,084 are held by the Company and the number of outstanding shares and voting rights attached to the shares amounts thus to 161,256,847 ",neutral
"Exel 's board of directors will propose a dividend of 0.2 euro $ 0.3 per share for 2006 at the annual general meeting on April 19 , 2007 ",neutral
"The decision reflects the underutilisation of the line , which produces nonwovens used in medical and wipes applications as well as for the automotive industry ",neutral
"The product advisory does not apply to any other Nokia-branded battery , the company said ",neutral
"Oka specialises in new construction , renovation work of residential and non-residential building as well as premises for industrial and logistical use ",neutral
Olli-Pekka Laine has been appointed as the Chairman and Erkki Pehu-Lehtonen as the Vice Chairman of the Board ,neutral
The business to be divested generates consolidated net sales of EUR 60 million annually and currently has some 640 employees ,neutral
Alfa group will have 43.9 % of voting stock in the new company and Telenor 35.4 % with a free float of 20.7 % ,neutral
"According to Seikku , the retail sector in Finland is controlled by 3-4 large actors , while food manufacturers are still relatively small ",neutral
Tekla Group 's net sales for 2006 were approximately 50 million euros and operating result 13.6 million euros ,neutral
The new B shares carry the right to dividend and other shareholder rights with effect from today ,neutral
"Rohwedder Group is an automotive supplies , telecommunications and electronics industry provider for customers in Europe , North America and Asia ",neutral
"Teleste 's hybrid TV solution includes components for the whole process of delivering video services to consumers from content acquisition and service creation to delivery through a range of access solutions , including HFC ( hybrid fibre-coaxial ) , xDSL , EttH , and FttH ",neutral
This release is not an offer of securities for sale into the United States or elsewhere ,neutral
Pertti Ervi is independent from the Company and its major shareholders ,neutral
"Following the move , Stora Enso holding in NewPage will remain unchanged ",neutral
"The 2500-passenger ferry will have dimensions of 185 m length overall , 170 m length between perpendiculars , 27.70 m breadth and 6.55 m design draught ",neutral
"Outotec 's scope of delivery covers the engineering , supply of special equipment and services for a calcination plant with two circulating fluid bed calciners ",neutral
"It is a member of the OneWorld alliance , which includes American Airlines and British Airways ",neutral
Risk exposure by Non-life Insurance  Moving 12-month  Expenses by function in Non-life Insurance excluding expenses for investment management and expenses for other services rendered Non-life Insurance investment portfolio by allocatio,neutral
"Sponda is a property investment company , specialising in commercial properties in the largest cities in Finland and Russia ",neutral
Lemmink+ï¿½inen started the manufacture of roofing felt in 1920 and the production of asphalt in the 1930s ,neutral
"The contract includes software licences , application maintenance and training ",neutral
"The manufacture of CPPs will be undertaken at the existing Export Oriented Unit EOU at Wartsila 's factory at Khopoli , near Mumbai ",neutral
"At the request of Finnish media company Alma Media 's newspapers , research manager Jari Kaivo-oja at the Finland Futures Research Centre at the Turku School of Economics has drawn up a future scenario for Finland 's national economy by using a model developed by the University of Denver ",neutral
Kaupthing Bank will publish its annual results for 2007 before markets open on Thursday 31 January ,neutral
The energy sector accounted for approximately 33 % and the steel industry for about 57 % of the transportation volume ,neutral
"Swedish , Finnish and Danish listed companies are organized in three market cap segments , Nordic Large Cap , Mid Cap and Small Cap ",neutral
`` Marimekko operates in an industry in which changes in the business climate are reflected in consumer demand ,neutral
"Changes being announced today will be effective after the close of trading on Friday , June 19 , 2009 ",neutral
"According to CapMan Plc 's Corporate Governance , the majority of the committees ' members shall be independent of the Company ",neutral
The machinery now ordered will be placed in a new mill with an annual production capacity of 40 000 m3 of overlaid birch plywood ,neutral
"A replay will be available until 27 October 2006 in the following numbers : US callers : +1 617-ï¿½801-ï¿½6888 , non-US callers : +44 20 7365 8427 , access code : 2659 5401 ",neutral
"Finnish bank Pohjola Bank Plc HEL : POH1S said today that it will issue a EUR 40 million USD 51.2 m index-linked bond , Pohjola Tutkimuksen Tahdet VIII-2010 Pohjola Research Stars VIII-2010 , on October 27 , 2010 ",neutral
"The contract covers the supply of temporary heating equipment for LKAB 's new pellet plant in Kiruna , in northern Sweden ",neutral
Yvonne Jones is owner of Chameleon Interiors ,neutral
"The building will house , for example , Respecta Oy 's Jyvaskyla premises , as well as other companies to be announced later , says Samuel Koivisto , Director of Technopolis operations in Jyvaskyla ",neutral
Affecto has participated in the program for the development of the Norwegian pension system since 2007 ,neutral
"Financial Statements include the consolidated financial statements of the Group , the Board of Directors ' Report , the Auditors ' Report and the Corporate Governance Statement ",neutral
"For 2009 , net profit was EUR 3 million and the company paid a dividend of EUR 1.30 apiece ",neutral
"According to the company , a decision in the issue will be made in the summer of 2010 , at the earliest , and in the summer of 2011 , at the latest ",neutral
N-Viro operates processing facilities independently as well as in partnership with municipalities ,neutral
"The Board established a Remuneration Committee with following members : - Sari Baldauf Chairman - Tapio Hintikka - Heikki Westerlund In addition , the Board decided to appoint a Nomination Committee at a later stage ",neutral
The deal will have no significant effect on the acquiring company 's equity ratio ,neutral
"no compensation for its news , opinions or distributions ",neutral
"The money will be spread mainly over 2011 and 2012 , the company said ",neutral
Two other sites will be included later on ,neutral
The order was worth EUR 8mn ,neutral
"The broker started UPM-Kymmene , Stora Enso and Sappi with ` equal-weight ' recommendations and Holmen and Norske Skog with ` underweight ' ratings ",neutral
"The Company serves approximately 3,000 customers in over 100 countries ",neutral
The purchase price was not disclosed ,neutral
"The shares shall be repurchased through public trading , for which reason the shares are repurchased otherwise than in proportion to the holdings of the shareholders ",neutral
The combined value of the orders is almost EUR 3mn ,neutral
"The biggest sellers in the chain 's supermarkets in Finland are organic Pirkka tomatoes , carrots , eggs , and meat products ",neutral
"The order comprises all production lines for a plywood mill , company said in a statement received by Lesprom Network ",neutral
Atria said its offer would give the Swedish company continued ownership and control of its slaughtering and cutting operations ,neutral
The financial statements release will be available after publishing on the Company 's internet pages at www.cargotec.com ,neutral
at 9:00 EET Alma Media 's Annual Report for 2009 is scheduled to be published in calendar week 9 ,neutral
The writing and publication of Lemmink+ï¿½inen -ï¿½ s history is a continuation of earlier collaboration between Antti Tuuri and the company ,neutral
Also the development of online businesses will continue ,neutral
The contract value amounts to EUR 2.4 million ,neutral
The sales price was not disclosed ,neutral
An earn-out payment of up to 4.0 mln euro ( $ 5.3 mln ) can also be paid depending on Intellibis financial performance in 2007 ,neutral
QPR ProcessGuide is available as a system solution with centralized storage and management of process content as well as a standalone desktop version ; QPR ProcessGuide Xpress ,neutral
"The transaction is subject to a final agreement between the parties , approvals of their decision-making bodies and approval by the Finnish Competition Authority ",neutral
"Arto Ryymin , born 1964 , will replace Juhani Kaisanlahti who has worked as acting EVP , Healthcare & Welfare since August 2007 ",neutral
"The start of the negotiations , relating to Glaston 's efficiency program , was announced in October ",neutral
"According to Gallup Food and Farm Facts , beef consumption totaled 99mn kilos in Finland in 2007 ",neutral
"In the first quarter of 2008 , Sacanfil 's net sales totalled EUR 50.0 mn and its operating profit EUR 4.7 mn ",neutral
"A. Le Coq Special was developed for the bicentenary of the company and the trade mark , the brewer said ",neutral
No planned closing date was provided ,neutral
Rental of building equipment accounted for 88 percent of the operating income ,neutral
"Componenta is a metal sector company with international operations and production plants located in Finland , the Netherlands , Sweden and Turkey ",neutral
"561,470 new shares under 2003 option rights plan Packaging company Huhtamaki Oyj reported on Monday that a total of 561,470 new shares of the company have been issued based on share subscriptions under its 2003 option rights plan ",neutral
"The Group 's turnover in 2006 was EUR 39.2 million , and operating profit was EUR 3.9 million ",neutral
Decisions are to be made as quickly as possible ,neutral
The first group of customers to be trained will be paint-shop owners and their assistants ,neutral
The share subscription period for C options will commence on 1 September 2008 and expire on 31 March 2011 ,neutral
"The company said that the operations will be sold to a newly established company , CPS GmbH , where the present management of the plastics business is a co-owner ",neutral
"The company 's transportation business is conducted through Florida Rock & Tank Lines , which is a Southeastern transportation company concentrating in the hauling by motor carrier of liquid and dry bulk commodities ",neutral
The agreement includes application maintenance and support services ,neutral
The name of the newspaper publishing and printing division Sanoma will be changed to Sanoma News ,neutral
The report will be emailed within 2 business days of an order ,neutral
The bank VTB24 provides mortgage loans to buy apartments in the complex at 11-13 % per annum in rubles ,neutral
"In 2008 , AVC Systemhaus had net sales of EUR 10 million USD 7.1 m ",neutral
"The maximum grade of the veneer yield is calculated , based on the dimensions and grades of the veneer products , as well as by iterating the places of the peeling axes and simulating the peeling process ",neutral
About Dopplr Dopplr is a service for smart travellers ,neutral
Pharmaceutical market in Poland Global Research & Data Services published recently a market analysis about the pharmaceutical markets in Poland ,neutral
The idea of saving electricity in data transfer is still a new one ,neutral
"In his current position , Manty has worked since 1996 ",neutral
`` They want my credit card info and my personal details ,neutral
"The Web-Marela application handles invitations to quote , quote comparisons , agreements , purchases , invoice inspections , inventory management , and deliveries ",neutral
"The floor area of the Yliopistonrinne project will be 7,900 sq m and the building 's gross area will total 12,800 sq m. A total 25.1 % of the facilities have been let ",neutral
"Finnish Kemira Group 's CEO , Lasse Kurkilahti , says the Group 's structural reorganisation will continue for at least a year ",neutral
The value of the orders is over EUR 10mn ,neutral
"Finnish printed circuit boards ( PCBs ) maker Aspocomp Group Oyj said on December 4 , 2006 it named Henry Gilchrist senior vice president of the group 's Asian operations , as of January 8 , 2007 ",neutral
"The Whitehall Street Real Estate Funds invest in real estate and real estate related assets , principally through the acquisition of real estate companies , real property and mortgage loans ",neutral
"At end-August , Sampo was Nordea 's biggest shareholder with a 20.6 % stake , followed by the state with 19.9 % ",neutral
"Incap , headquartered in Oulu , Finland , is a electronics contract manufacturer with some 750 employees in Finland , Estonia and India ",neutral
The order is included in Metso 's fourth quarter 2007 order backlog ,neutral
"From 2003 on , the emphasis of Kyro 's strategy has been on Glaston 's growth ",neutral
The fair value of CapMan Plc 's own investments on 30 September 2008 amounted to MEUR 59.8 ,neutral
The turbines are expected to be launched by the end of 2012 ,neutral
"Cohen & Steers , Inc. : 5 534 530 shares representing 4.985 % of the share capital and voting rights ",neutral
"The Inventors are Ridge Justin , Bao Yiliang and Karczewicz Marta ",neutral
"Elcoteq Dongguan was established in 1999 in the Nancheng District of Dongguan , China and is one of Elcoteq s four volume manufacturing plants in the Asia-Pacific region ",neutral
The value of the order is EUR 2.5 mn ,neutral
Combined net sales in 2006 were $ 27 million and EBITDA was $ 13.7 million ,neutral
"Name of Applicant : Jot Automation OYName of Inventor : Mammila Tuomo , Piirainen Mika and Kellokoski MikaApplication No. : 2424-KOLNP-2008 ADate of filing of Application : 16-06-2008Publication Date : 30/01/200",neutral
Negotiations with representatives of the personnel regarding the restructuring process have now been ended ,neutral
"In 2006 , 452 million tonnes CO2 of EUA ( EU Allowance ; emissions credit in EU ) was traded with an underlying market value approx ",neutral
Jon Risfelt is 49 years old holds a Master of Science in Chemical Engineering from the Swedish Royal Institute of Technology ,neutral
"The talks involved the Food and Ingredients Divisions , as well as group service functions , the company said ",neutral
All depends on financing ,neutral
"In addition to the Tulikivi Corporation , he is also currently a member of the Board of the following companies : Altia Corporation , J+ï¿½rvi-Suomen Portti Osuuskunta , Osuuskunta KPY , Profile Vehicles Oy and Voimatel Oy ",neutral
"Utah 's capital wanted to be the next U.S. headquarters of Amer Sports Corp. , a ski-equipment company ",neutral
Work on the assignment has already started and is due for completion in spring 2011 ,neutral
"Fortum needs a clear signal of commitment from the Government that the permit is available before the company will start the next round , Kuula says ",neutral
The transaction value is CAD 15 million approximately EUR 10 million ,neutral
The expanded plant is scheduled to be operational by the middle of October 2009 ,neutral
The solid fuel is heated before sludge is mixed therein . ',neutral
Mursula said they tried to gather macro-economic perspective to see how Malaysia was doing ,neutral
Its 168 asset management experts manage assets worth over EUR 35 billion ,neutral
The estimated value of the deal is USD 9.2 million ,neutral
The phones are targeted at first time users in growth markets ,neutral
`` Serving customers locally is one of the cornerstones of customer focus for us ,neutral
The issuer is solely responsible for the content of this announcement ,neutral
"Currently Glaston employs approximately 1,500 persons ",neutral
"These sections will be put into place to form the load-bearing steel structure of the bridge , '' says Sami Eronen , Senior Vice President , Infrastructure and Northern Europe , Ruukki Construction ",neutral
`` Printed fabrics and related design expertise have always been the core of Marimekko 's business and brand ,neutral
The company then said it will focus its resources on clinical research ,neutral
"The order consists of outsourced application management , support and planning for Tecnotree and third-party applications ",neutral
"After the split , the company would have 26,885,540 Series A shares and 9,540,000 Series K shares ",neutral
"Cablevision Systems Corp. CVC Their Madison Square Garden division owns and operates the New York Knickerbockers basketball team ; they also own the Madison Square Garden Arena , the New York Rangers hockey team , the New York Liberty women 's basketball team , and the Hartford Wolf Pack hockey team ",neutral
"The contracts between Raute Corporation and Muling Kemian Wood Products Co. , Ltd. , which were announced on 3 November 2010 , have taken effect ",neutral
The business area 's net sales were slightly over 2m in 2006 ,neutral
The transaction included also the transfer of the lease agreement concerning manufacturing premises and employment agreements related to these operations ,neutral
The order includes 48 ship cranes that will be delivered for 12 container feeders to be built at Wenchong shipyard in China ,neutral
"Kemira , headquartered in Helsinki , Finland , is an international chemicals group comprising the business areas Kemira Pulp & Paper , Kemira Water , Kemira Specialty and Kemira Coatings ",neutral
The project also implies an underground parking lot for 56 vehicles ,neutral
"The business is organised , as of February 1 , 2011 , in a way that production of design services is combined into one entity , Etteplan Operations ",neutral
Niklas Skogster has been employed by the ABB Group in various positions concerning the development of operations ,neutral
Talvivaara is listed on the London Stock Exchange Main Market and NASDAQ OMX Helsinki and is included in the FTSE 250 Index ,neutral
Panostaja did not disclose the purchase price ,neutral
"The utility will also provide services related to electricity management , such as hedging trades and risk management and reporting ",neutral
"As an alternative to the share exchange , Panostaja offers a full cash consideration at the value of 1.27 euro $ 1.7 per share ",neutral
"The new majority owners of Aspocomp Thailand Co. , Ltd are certain private persons belonging to immediate circle of Aspocomp 's present Joint Venture partner , Saha Pathana Inter-Holding Plc. ",neutral
"Trading in the new shares , which have right to dividends and other distributions of funds , will start on the exchange in Helsinki tomorrow ",neutral
"Most of the raw materials come from Europe and the US and are paid in euros or US dollars , while sales take place in rubles ",neutral
"BasWare is headquartered in Espoo , Finland ",neutral
"The company is also seeking possibilities to relocate the Luumaki personnel , some 50 people , to other UPM mills ",neutral
The value of the orders is about EUR 70mn ,neutral
"Stockholm-based Nordea Bank ( STO : NDA ) said yesterday it had hired Casper von Koskull to lead its corporate merchant banking and capital markets unit , effective 1 September ",neutral
The contract is for next year ,neutral
"The latest result included per-share charges of 5 cents for stock compensation , 1 cent for research and development and 1 cent for strategic investments ",neutral
It is estimated that the consolidated turnover of Kausta Guder will reach Lt 53mn US$ 22.53 mn EUR 15.35 mn in 2007 ,neutral
Talvivaara Mining Company Plc Talvivaara Mining Company is an internationally significant base metals producer with its primary focus on nickel and zinc using a technology known as bioheapleaching to extract metals out of ore ,neutral
"With this , the company will exit the contract manufacturing service segment ",neutral
"N +1 Group will pay EUR16 .5 m of the transaction price upon closing , and the remaining sum in 2012 ",neutral
"The fish content of the nuggets is 85 % , and the fish comes from Canada and Finland ",neutral
Grounds for the notification : Tiimari Plc 12/30/2010 issued Capital Convertible Loan allocation decision by the Board on 01/31/2011 ,neutral
ZAO YIT Moskovia builds housing in Moscow and its surrounding cities ,neutral
"Yara Suomi Ltd also provides nitrogen chemicals and technical nitrates to various sectors of industry , as well as products used in environmental protection ",neutral
The transaction is expected to be completed next spring ,neutral
"The hosting mobile terminal guides information flow between itself , the participating terminals , and optionally , with network servers that may assist the hosting mobile terminal ",neutral
Castecka said the town hall would hold talks with other investors interested in the zone ,neutral
"The reductions will be implemented immediately , beginning in October 2009 ",neutral
"Construction work on the Helsinki Music Centre is to start this autumn , with the total cost of the project estimated at 140 million euros ",neutral
The value of this kind of order amounts usually between Euro 2 and 3 million ,neutral
In the meantime the CEO 's duties will be assumed by Outotec 's Deputy CEO Seppo Rantakari ,neutral
Short-term licenses for the games cost as little as $ 3 while purchasing a game outright can cost as much as $ 10 or $ 15 ,neutral
The contract includes heating plant equipment and associated installation work ,neutral
"By the end of 2006 , the number of joint branch offices will total 170 ",neutral
The value of the contract is in total USD12m ,neutral
"We know that it exists , '' Artemyev said ",neutral
"Mr. Mikko Saavalainen , head of Comptel 's Global Sales concludes : `` Gibtelecom provides a perfect illustration of the variety of business , technical and regulatory challenges operators are facing in their OSS today ",neutral
The platform would continue to be the development framework for Symbian and MeeGo ,neutral
"In addition to its stake in MegaFon , Telecominvest currently owns 100 % of shares in Web Plus and St. Petersburg Payphones , 51 % in telecom equipment producer Peter-Servis and a number of other minor assets ",neutral
"Tikkurila , a division of Kemira group , controls about 23 % of the Russian market in its field and owns St. Petersburg paint producer TEX. ",neutral
Cargotec will also move Hallberg-Ivarsson 's service and installation business under the same roof with its service center for Kalmar and MacGregor solutions in Gothenburg ,neutral
